sort,name,native,degree,year,award,title,title2,,,,
90,Kota Adachi,足立 幸太,MA,2021Mar,,斜面流れを考慮した全球陸域モデルによる丘-谷間水分コントラストの再現,Represent hill valley moisture contrast by Land Surface Model with lateral subsurface flow,,,,
80,Kotaro Hamada,浜田 光太郎,MA,2021Mar,,土壌の水平・鉛直分布を 考慮した陸面モデルの開発,Development of a land surface model considering horizontal and vertical variability,,,,
70,Robuil MD Islam,,MA,2020Sep,,A Study on Fluvial Flood Synchronization at a Global Scale,全球スケールでの河川洪水の同時発生に関する研究,,,,
60,Yuki Ishikawa,石川 悠生,BA,2020Mar,,全球高解像度での農地ポテンシャルの推定と実農地分布との比較分析,Global High-Resolution Estimation of Cropland Suitability and its Comparative Analysis to Actual Cropland Distribution,,,,
50,Takuto Shiozawa,塩澤 拓斗,MA,2020Mar,,河川モデルと衛星観測データの融合による河川水面下地形の広域推定,Estimation of underwater terrain at a large scale by combining a river model and satellite observation dataset,,,,
40,Yoshiaki Tanaka,田中 良明,MA,2020Mar,,全米における全球河川モデルへの堤防導入手法構築と堤防立地特性の分析,Development of levee scheme in a global river model and analysis of levee location characteristics in contiguous U.S.,,,,
30,Kotaro Hamada,浜田 光太郎,BA,2019Mar,田辺賞,全球スケールの高解像度河川・湖沼分類マップの開発と時系列分析,Development of a global high resolution river and lake map and its time series analysis,,,,
20,Hiroaki Ikeuchi,池内 寛明,Ph.D,2019Mar,,大陸河川沿岸デルタ域における複合洪水氾濫モデリングに関する研究,Development of a modelling framework for compound ﬂooding in coastal deltas of the world’s continental rivers,,,,
10,Ryo Taguchi,田口諒,MA,2019Mar,,全球スケールでの洪水経済被害分析における営業停止損失の重要性,Importance of the Business Interruption Loss in Global-scale Analysis of the Flood Damage on Economics,,,,